{
  "schema_version": "1.0.0",
  "trajectory_id": "traj-gate-live-create-stat-dashboard-from-testdata-9.5.21",
  "site_key": "grafana-oss@9.5.21",
  "task_key": "create-stat-dashboard-from-testdata",
  "recorded_at": "2026-10-23T02:01:12.711Z",
  "base_url_template": "http://{host}:{port}",
  "provenance": {
    "recorder": "0.1.0-b2",
    "agent_model": "human",
    "testbed_version": "9.5.21",
    "notes": "ADR-0006 gate task recorded live against Grafana OSS 9.5.21 seeded by npm run testbed. Login and the first-run dialog are preamble, not steps. Credentials come from env and are never written here."
  },
  "parameters": {
    "host": "string",
    "port": "integer",
    "series_alias": "string",
    "series_count": "integer",
    "panel_title": "string",
    "dashboard_title": "string",
    "dashboard_uid": "string",
    "dashboard_slug": "string"
  },
  "steps": [
    {
      "step_index": 0,
      "intent": "Open the new-dashboard page",
      "action": {
        "type": "navigate",
        "url_template": "http://{host}:{port}/dashboard/new",
        "param_refs": [
          "host",
          "port"
        ]
      },
      "locator_candidates": [],
      "pre_state": {
        "url_template": "http://{host}:{port}/?orgId=1",
        "title_template": "Grafana",
        "dom_digest": "ca8a6f653ae6c403",
        "visible_landmarks": [
          "main",
          "navigation",
          "banner"
        ],
        "network_idle": false
      },
      "post_state": {
        "url_template": "http://{host}:{port}/dashboard/new?orgId=1",
        "title_template": "New dashboard - Dashboards - Grafana",
        "dom_digest": "f0c1f22eeca36053",
        "visible_landmarks": [
          "main",
          "navigation",
          "banner"
        ],
        "network_idle": true
      },
      "timing_ms": {
        "started_offset_ms": 0,
        "duration_ms": 641
      },
      "assertion_hint": {
        "suggested_type": "url-matches",
        "observed_signals": [
          "navigation completed"
        ]
      }
    },
    {
      "step_index": 1,
      "intent": "Add a visualization to the empty dashboard",
      "action": {
        "type": "click"
      },
      "locator_candidates": [
        {
          "strategy": "role_name",
          "rank": 1,
          "role": "button",
          "name": "Add new panel",
          "tenant_scoped": true
        },
        {
          "strategy": "label",
          "rank": 2,
          "label": "Add new panel",
          "tenant_scoped": true
        },
        {
          "strategy": "structural",
          "rank": 3,
          "structural_path": "div:nth-of-type(2) > div:nth-of-type(3) > div > div:nth-of-type(1) > div > div > div:nth-of-type(1) > div > div > div > div:nth-of-type(1) > button",
          "tenant_scoped": false
        },
        {
          "strategy": "text",
          "rank": 4,
          "text": "Add visualization",
          "tenant_scoped": true
        }
      ],
      "pre_state": {
        "url_template": "http://{host}:{port}/dashboard/new?orgId=1",
        "title_template": "New dashboard - Dashboards - Grafana",
        "dom_digest": "f0c1f22eeca36053",
        "visible_landmarks": [
          "main",
          "navigation",
          "banner"
        ],
        "network_idle": false
      },
      "post_state": {
        "url_template": "http://{host}:{port}/dashboard/new?orgId=1&editPanel=1",
        "title_template": "Edit panel - New dashboard - Dashboards - Grafana",
        "dom_digest": "006b965317eacdbc",
        "visible_landmarks": [
          "main",
          "navigation"
        ],
        "network_idle": true
      },
      "timing_ms": {
        "started_offset_ms": 641,
        "duration_ms": 862
      },
      "assertion_hint": {
        "suggested_type": "element-visible",
        "observed_signals": [
          "click target resolved"
        ]
      },
      "post_action_target_visible": false,
      "controls_appeared": 115
    },
    {
      "step_index": 2,
      "intent": "Open the visualization picker",
      "action": {
        "type": "click"
      },
      "locator_candidates": [
        {
          "strategy": "role_name",
          "rank": 1,
          "role": "button",
          "name": "toggle-viz-picker",
          "tenant_scoped": true
        },
        {
          "strategy": "label",
          "rank": 2,
          "label": "toggle-viz-picker",
          "tenant_scoped": true
        },
        {
          "strategy": "css_vocab",
          "rank": 3,
          "css": "[aria-label=\"Panel editor option pane content\"] > div:nth-of-type(1) > div > div > button:nth-of-type(1)",
          "tenant_scoped": true
        },
        {
          "strategy": "structural",
          "rank": 4,
          "structural_path": "main > div:nth-of-type(2) > div:nth-of-type(4) > div > div > div > div:nth-of-type(2) > div > div:nth-of-type(1) > div > div > button:nth-of-type(1)",
          "tenant_scoped": false
        },
        {
          "strategy": "text",
          "rank": 5,
          "text": "Time series",
          "tenant_scoped": true
        }
      ],
      "pre_state": {
        "url_template": "http://{host}:{port}/dashboard/new?orgId=1&editPanel=1",
        "title_template": "Edit panel - New dashboard - Dashboards - Grafana",
        "dom_digest": "006b965317eacdbc",
        "visible_landmarks": [
          "main",
          "navigation"
        ],
        "network_idle": false
      },
      "post_state": {
        "url_template": "http://{host}:{port}/dashboard/new?orgId=1&editPanel=1",
        "title_template": "Edit panel - New dashboard - Dashboards - Grafana",
        "dom_digest": "dee4609c1269959d",
        "visible_landmarks": [
          "main",
          "navigation"
        ],
        "network_idle": true
      },
      "timing_ms": {
        "started_offset_ms": 1504,
        "duration_ms": 1414
      },
      "assertion_hint": {
        "suggested_type": "element-visible",
        "observed_signals": [
          "click target resolved"
        ]
      },
      "post_action_target_visible": true,
      "controls_appeared": 27
    },
    {
      "step_index": 3,
      "intent": "Choose the Stat visualization",
      "action": {
        "type": "click"
      },
      "locator_candidates": [
        {
          "strategy": "label",
          "rank": 1,
          "label": "Plugin visualization item Stat",
          "tenant_scoped": true
        },
        {
          "strategy": "css_vocab",
          "rank": 2,
          "css": "[aria-label=\"Panel editor option pane content\"] > div > div:nth-of-type(2) > div > div:nth-of-type(1) > div > div > div:nth-of-type(3)",
          "tenant_scoped": true
        },
        {
          "strategy": "structural",
          "rank": 3,
          "structural_path": "div > div > div > div:nth-of-type(2) > div > div > div:nth-of-type(2) > div > div:nth-of-type(1) > div > div > div:nth-of-type(3)",
          "tenant_scoped": false
        },
        {
          "strategy": "text",
          "rank": 4,
          "text": "StatBig stat values & sparklines",
          "tenant_scoped": true
        }
      ],
      "pre_state": {
        "url_template": "http://{host}:{port}/dashboard/new?orgId=1&editPanel=1",
        "title_template": "Edit panel - New dashboard - Dashboards - Grafana",
        "dom_digest": "dee4609c1269959d",
        "visible_landmarks": [
          "main",
          "navigation"
        ],
        "network_idle": false
      },
      "post_state": {
        "url_template": "http://{host}:{port}/dashboard/new?orgId=1&editPanel=1",
        "title_template": "Edit panel - New dashboard - Dashboards - Grafana",
        "dom_digest": "ad8310475c914b69",
        "visible_landmarks": [
          "main",
          "navigation"
        ],
        "network_idle": true
      },
      "timing_ms": {
        "started_offset_ms": 2918,
        "duration_ms": 1461
      },
      "assertion_hint": {
        "suggested_type": "element-visible",
        "observed_signals": [
          "click target resolved"
        ]
      },
      "post_action_target_visible": false,
      "controls_appeared": 49
    },
    {
      "step_index": 4,
      "intent": "Name the query series",
      "action": {
        "type": "fill",
        "param_refs": [
          "series_alias"
        ]
      },
      "locator_candidates": [
        {
          "strategy": "role_name",
          "rank": 1,
          "role": "textbox",
          "name": "Alias",
          "tenant_scoped": true
        },
        {
          "strategy": "label",
          "rank": 2,
          "label": "Alias",
          "tenant_scoped": true
        },
        {
          "strategy": "css_vocab",
          "rank": 3,
          "css": "[aria-label=\"Test Data Query scenario select container\"] > div:nth-of-type(2) > div > div > div > input",
          "tenant_scoped": true
        },
        {
          "strategy": "structural",
          "rank": 4,
          "structural_path": "div > div > div > div > div:nth-of-type(2) > div > div:nth-of-type(1) > div:nth-of-type(2) > div > div > div > input",
          "tenant_scoped": false
        },
        {
          "strategy": "placeholder",
          "rank": 5,
          "name": "optional",
          "tenant_scoped": true
        }
      ],
      "pre_state": {
        "url_template": "http://{host}:{port}/dashboard/new?orgId=1&editPanel=1",
        "title_template": "Edit panel - New dashboard - Dashboards - Grafana",
        "dom_digest": "ad8310475c914b69",
        "visible_landmarks": [
          "main",
          "navigation"
        ],
        "network_idle": false
      },
      "post_state": {
        "url_template": "http://{host}:{port}/dashboard/new?orgId=1&editPanel=1",
        "title_template": "Edit panel - New dashboard - Dashboards - Grafana",
        "dom_digest": "ad8310475c914b69",
        "visible_landmarks": [
          "main",